{
  "format": "terrain-patch/1",
  "package": {
    "name": "synthetic-test-ground",
    "version": "0.0.0",
    "sha256": "f85303859cde70860948826d71afb86a0599e9ea97b1bb927a26a4ad90edc348"
  },
  "patch": {
    "file": "patch.tif",
    "sha256": "b1ee7a2ac3ca5a05fce1c48bd02269ccf4c5657c641fc8de607975fa1d9c9569",
    "level": 0,
    "pixelSizeMetres": 0.25,
    "width": 142,
    "height": 142,
    "origin": {
      "x": -10.25,
      "y": 20.45
    }
  },
  "crs": {
    "name": "SYNTHETIC-SITE",
    "definition": "synthetic test ground with no real projection: x east, y north, metres"
  },
  "frame": "site: x east, y north, z up, metres; heights above mean sea level",
  "verticalDatum": {
    "name": "mean sea level",
    "seaLevelMetres": 0.0
  },
  "water": {
    "distanceToShoreMetres": null
  },
  "licence": {
    "statement": "CC0-1.0: synthetic test data, no restrictions",
    "source": "generated by tools/make_sample_terrain.py"
  }
}
